[
  {
    "id": "one-green-action",
    "label": "One green action per screen",
    "status": "locked",
    "version": "1.0",
    "updated": "2026-10-23",
    "audience": "public",
    "type": "rule",
    "title": "Use Comet Green for one action per screen",
    "chapter": "color-use",
    "body": "Comet Green marks the single most important action on a screen. Everything else uses Ink, Slate, Kiln White, and the background colors.",
    "do": [
      "Use Comet Green for the main button",
      "Set text on Comet Green in Kiln White"
    ],
    "dont": [
      "Color two buttons green on the same screen",
      "Use Comet Green for body text"
    ],
    "appliesTo": [
      "comet-green",
      "ink",
      "kiln-white",
      "copper",
      "slate",
      "mist",
      "clay"
    ]
  },
  {
    "id": "logo-clear-space",
    "label": "Logo clear space",
    "status": "locked",
    "version": "1.0",
    "updated": "2026-10-22",
    "audience": "public",
    "type": "rule",
    "title": "Keep clear space around the logo",
    "chapter": "logo-use",
    "body": "Leave space on every side of the logo equal to the height of the comet head. Nothing else sits inside that space.\n\nUse the reversed logo on Ink or Comet Green. Use the full color logo on Kiln White or white.",
    "do": [
      "Use the file that matches the background",
      "Scale the logo from the corner so it keeps its shape"
    ],
    "dont": [
      "Stretch, rotate, or recolor the logo",
      "Place the full color logo on a dark photo"
    ],
    "appliesTo": [
      "logo-horizontal",
      "logo-horizontal-reversed",
      "logo-stacked",
      "logo-mark"
    ]
  },
  {
    "id": "photo-natural-light",
    "label": "Photo style",
    "status": "locked",
    "version": "1.0",
    "updated": "2026-10-22",
    "audience": "public",
    "type": "rule",
    "title": "Photograph in natural light",
    "chapter": "photography",
    "body": "Photos show real teapots in use, lit by daylight. Keep backgrounds plain and colors true to life.",
    "do": [
      "Shoot near a window",
      "Keep steam and pouring in frame when it tells the story"
    ],
    "dont": [
      "Add filters or color grading",
      "Use stock photos of tea we do not make"
    ],
    "appliesTo": [
      "photo-library"
    ]
  },
  {
    "id": "headshot-standard",
    "label": "Headshot standard",
    "status": "locked",
    "version": "1.0",
    "updated": "2026-10-22",
    "audience": "public",
    "type": "rule",
    "title": "Take headshots against Kiln White",
    "chapter": "headshots",
    "body": "Headshots are shoulders up, centered, against a plain Kiln White wall, in daylight. Export at 1200 by 1200 pixels.",
    "do": [
      "Face the camera with eyes level with the lens",
      "Crop to a square"
    ],
    "dont": [
      "Use a busy background",
      "Use photos older than two years"
    ],
    "appliesTo": [
      "photo-library"
    ]
  },
  {
    "id": "template-type",
    "label": "Template text",
    "status": "locked",
    "version": "1.0",
    "updated": "2026-10-23",
    "audience": "public",
    "type": "rule",
    "title": "Keep template text in Inter",
    "chapter": "templates",
    "body": "Templates set all text in Inter. Change words and photos, not fonts, colors, or layout.",
    "do": [
      "Replace sample text with your own",
      "Keep the logo where the template places it"
    ],
    "dont": [
      "Change the font",
      "Move the logo out of its clear space"
    ],
    "appliesTo": [
      "template-letterhead",
      "template-slide-deck",
      "template-social-post"
    ]
  },
  {
    "status": "locked",
    "version": "1.0",
    "updated": "2026-10-23",
    "audience": "public",
    "id": "color-backgrounds",
    "label": "Background colors",
    "type": "rule",
    "title": "Use Kiln White for pages, Mist and Clay for panels",
    "chapter": "backgrounds",
    "body": "Kiln White is the page background. Mist and Clay set a panel or section apart. Use one panel color per page.\n\nSet text on these backgrounds in Ink or Slate.",
    "do": [
      "Use Mist for a highlighted section",
      "Use Clay for seasonal and gift panels"
    ],
    "dont": [
      "Put Mist and Clay panels next to each other",
      "Set Slate text on Comet Green"
    ],
    "appliesTo": [
      "kiln-white",
      "slate",
      "mist",
      "clay"
    ]
  },
  {
    "status": "locked",
    "version": "1.0",
    "updated": "2026-10-23",
    "audience": "public",
    "id": "type-pairing",
    "label": "Type pairing",
    "type": "rule",
    "title": "Fraunces for headings, Inter for everything else",
    "chapter": "type",
    "body": "Set page titles and section headings in Fraunces at weight 500. Set body text, labels, and buttons in Inter.\n\nUse 600 for emphasis in either family. Do not use other weights.",
    "do": [
      "Keep headings short so Fraunces stays readable",
      "Use Inter for numbers in tables"
    ],
    "dont": [
      "Set body text in Fraunces",
      "Use more than two weights on one page"
    ],
    "appliesTo": [
      "fraunces",
      "inter"
    ]
  },
  {
    "status": "locked",
    "version": "1.0",
    "updated": "2026-10-23",
    "audience": "public",
    "id": "icon-style",
    "label": "Icon style",
    "type": "rule",
    "title": "Use icons from the library at 16px or larger",
    "chapter": "icons",
    "body": "The icon library uses Bootstrap Icons, drawn on a 16px grid with filled shapes. Use them at 16, 24, or 32 pixels so the lines stay sharp.\n\nColor icons with Ink, Comet Green, or Copper. Pair an icon with a text label unless the meaning is universal, like Search or Close.",
    "do": [
      "Use the pinned icons for common actions",
      "Download SVG for print and slides"
    ],
    "dont": [
      "Mix icons from other libraries",
      "Stretch or outline an icon"
    ],
    "appliesTo": [
      "icon-search",
      "icon-download",
      "icon-copy",
      "icon-check-lg",
      "icon-x-lg",
      "icon-list",
      "icon-plus-lg",
      "icon-arrow-right",
      "icon-dash-lg",
      "icon-arrow-left",
      "icon-arrow-up-right",
      "icon-chevron-down",
      "icon-chevron-right",
      "icon-box-arrow-up-right",
      "icon-link-45deg",
      "icon-gear",
      "icon-sliders",
      "icon-funnel",
      "icon-three-dots",
      "icon-pencil",
      "icon-trash",
      "icon-eye",
      "icon-upload",
      "icon-share",
      "icon-house",
      "icon-bell",
      "icon-info-circle",
      "icon-question-circle",
      "icon-exclamation-triangle",
      "icon-envelope",
      "icon-telephone",
      "icon-chat",
      "icon-person",
      "icon-people",
      "icon-calendar",
      "icon-clock",
      "icon-geo-alt",
      "icon-globe",
      "icon-cart",
      "icon-bag",
      "icon-basket",
      "icon-credit-card",
      "icon-receipt",
      "icon-truck",
      "icon-box-seam",
      "icon-gift",
      "icon-tag",
      "icon-shop",
      "icon-cup-hot",
      "icon-cup",
      "icon-droplet",
      "icon-fire",
      "icon-thermometer-half",
      "icon-hourglass-split",
      "icon-flower1",
      "icon-tree",
      "icon-sun",
      "icon-moisture",
      "icon-file-earmark",
      "icon-file-earmark-pdf",
      "icon-file-earmark-image",
      "icon-file-earmark-zip",
      "icon-folder",
      "icon-image",
      "icon-camera",
      "icon-printer"
    ]
  }
]
